{
  "$schema": "https://ontology-dashboard.local/schemas/generator-gen-data-extraction-checkpoint.schema.json",
  "checkpoint_schema_version": "generator-gen-data-extraction-checkpoint-v1",
  "source_identity": "9f86d081884c7d659a2feaa0c55ad015a3bf4f1b2b0b822cd15d6c15b0f00a08",
  "source_uri": "sensor/facS01/lineL01/sensor_stream.jsonl",
  "source_format": "gen_data_sensor_stream",
  "site_id": "S01",
  "cell_id": "L01",
  "last_committed_offset": 12400,
  "last_committed_line": 100,
  "last_observed_at": "2026-08-28T13:00:00Z",
  "verified_prefix_length": 4096,
  "verified_prefix_sha256": "e3b0c44298fc1c149afbf4c8996fb92427ae41e4649b934ca495991b7852b855",
  "last_committed_batch_id": "a1b2c3d4e5f60718293a4b5c6d7e8f90123456789abcdef0123456789abcdef0",
  "committed_batch_ids": [
    "a1b2c3d4e5f60718293a4b5c6d7e8f90123456789abcdef0123456789abcdef0"
  ],
  "pending_batch": null,
  "status": "idle",
  "created_at": "2026-08-28T13:00:00Z",
  "updated_at": "2026-08-28T13:05:00Z"
}
